{
  "$schema": "./deps.lock.schema.json",
  "schemaVersion": 3,
  "approvedBy": "UNAPPROVED: isolated reproducibility candidate; original source approval remains in workspace lock",
  "approvedAt": "2026-07-26",
  "mode": "preparation",
  "toolchain": {
    "vs": "[17.0,18.0)",
    "toolset": "v143",
    "arch": "x64",
    "crt": "MT",
    "config": "Release"
  },
  "components": {
    "bx": {
      "kind": "git",
      "wave": "core",
      "upstream": "https://github.com/bkaradzic/bx",
      "version": "production-v1",
      "commit": "5a2b876258ab5843d5e1dfde695b127baf9e354a",
      "archive": {
        "url": "https://codeload.github.com/bkaradzic/bx/tar.gz/5a2b876258ab5843d5e1dfde695b127baf9e354a",
        "sha256": "3F7E07B24429ACA9A262ED84489F461650DEBA93890F3FE4E9263D85E4A5E411",
        "bytes": 1510054
      },
      "licenseFiles": [
        {
          "pathInSource": "LICENSE",
          "sha256": "AC2E0D253B1584316A36A0FAE1D4407FA3EBCB15F27021AB479B23D27F0C9C08",
          "license": "BSD-2-Clause"
        }
      ],
      "patches": [],
      "buildProfile": {
        "system": "genie",
        "flags": [
          "--with-tools",
          "--with-amalgamated",
          "vs2022"
        ],
        "inherit": "toolchain"
      },
      "outputs": [
        {
          "path": "out/modern-bgfx/src/bgfx/.build/win64_vs2022/bin/bxRelease.lib",
          "sha256": "9150E588DF3C921D4F7CBE7F159459E2093D144632B47395120029113DA50BA1",
          "bytes": 1584136
        }
      ],
      "dependsOn": []
    },
    "bimg": {
      "kind": "git",
      "wave": "core",
      "upstream": "https://github.com/bkaradzic/bimg",
      "version": "production-v1",
      "commit": "da38bface6384cdd7f69733b08fb58e57a63cffa",
      "archive": {
        "url": "https://codeload.github.com/bkaradzic/bimg/tar.gz/da38bface6384cdd7f69733b08fb58e57a63cffa",
        "sha256": "0FB9440CEB7288E4A5C93126248342B262156EB6D8122ED09A478FBD2F88C74C",
        "bytes": 1498006
      },
      "licenseFiles": [
        {
          "pathInSource": "LICENSE",
          "sha256": "AC2E0D253B1584316A36A0FAE1D4407FA3EBCB15F27021AB479B23D27F0C9C08",
          "license": "BSD-2-Clause"
        }
      ],
      "patches": [],
      "buildProfile": {
        "system": "genie",
        "flags": [
          "--with-tools",
          "--with-amalgamated",
          "vs2022"
        ],
        "inherit": "toolchain"
      },
      "outputs": [
        {
          "path": "out/modern-bgfx/src/bgfx/.build/win64_vs2022/bin/bimgRelease.lib",
          "sha256": "4DDD7D096509B7302C6D6347E6F02164B15DC8FAD1E55135975D56440FFACE50",
          "bytes": 3202224
        },
        {
          "path": "out/modern-bgfx/src/bgfx/.build/win64_vs2022/bin/bimg_decodeRelease.lib",
          "sha256": "E09697887E1333E1410E18CEF81222CBCBB340BB3B914E90068473277ACAF534",
          "bytes": 8159204
        }
      ],
      "dependsOn": [
        "bx"
      ]
    },
    "genie": {
      "kind": "in-tree",
      "wave": "W0",
      "upstream": "https://github.com/bkaradzic/GENie",
      "version": "official-prebuilt-in-production-v1-bx",
      "commit": "af2285653cc010e0930518d49964c95ea30d7115",
      "licenseFiles": [
        {
          "pathInSource": "LICENSE",
          "sha256": "360AC70B85D4755EAE37DD4804AC7C5E6C3971BFEAE6AC3A0BF7BEB60F8BC6D2",
          "license": "BSD-3-Clause"
        }
      ],
      "patches": [],
      "buildProfile": {
        "system": "in-tree",
        "flags": [
          "verify-only",
          "no-execution-before-sha256"
        ],
        "inherit": "toolchain"
      },
      "outputs": [
        {
          "path": "out/modern-bgfx/src/bx/tools/bin/windows/genie.exe",
          "sha256": "72461C6A69742DCB66F30470F98FAF6DFE47D86333FC360E2FA9CA024EE2297A",
          "bytes": 575488
        }
      ],
      "dependsOn": [
        "bx"
      ],
      "sourceOffer": {
        "url": "https://codeload.github.com/bkaradzic/GENie/tar.gz/af2285653cc010e0930518d49964c95ea30d7115",
        "sha256": "202B235D8DF38E9F28D6EE9E44C0003774BEE83F1143ED72E25DE8F91C86279A"
      }
    },
    "bgfx": {
      "kind": "git",
      "wave": "core",
      "upstream": "https://github.com/bkaradzic/bgfx",
      "version": "production-v1",
      "commit": "65551a7db19240b4d105f09e665190d196243d92",
      "archive": {
        "url": "https://codeload.github.com/bkaradzic/bgfx/tar.gz/65551a7db19240b4d105f09e665190d196243d92",
        "sha256": "43B0F6C9B9CD3C939F61071DE8FD2B3217EAF23C99F169D2E1FF26C0FEFEC75C",
        "bytes": 120869246
      },
      "licenseFiles": [
        {
          "pathInSource": "LICENSE",
          "sha256": "AC2E0D253B1584316A36A0FAE1D4407FA3EBCB15F27021AB479B23D27F0C9C08",
          "license": "BSD-2-Clause"
        }
      ],
      "patches": [],
      "buildProfile": {
        "system": "genie",
        "flags": [
          "--with-tools",
          "--with-amalgamated",
          "vs2022"
        ],
        "inherit": "toolchain"
      },
      "outputs": [
        {
          "path": "out/modern-bgfx/src/bgfx/.build/win64_vs2022/bin/bgfxRelease.lib",
          "sha256": "03760110FAC23C1F91A2ABAB8D16DFD11C138377D7947DA7EF8D78E63E0CAF93",
          "bytes": 9186256
        },
        {
          "path": "out/modern-bgfx/src/bgfx/.build/win64_vs2022/bin/shadercRelease.exe",
          "sha256": "197C9B39C43408B0E8E9DCF77D8FC3CDAA200668530EBCC2800D502DF3170CB3",
          "bytes": 10238464
        }
      ],
      "dependsOn": [
        "bx",
        "bimg",
        "genie"
      ]
    },
    "libogg": {
      "kind": "archive",
      "wave": "W1",
      "upstream": "https://xiph.org/ogg/",
      "version": "1.3.3",
      "archive": {
        "url": "https://downloads.xiph.org/releases/ogg/libogg-1.3.3.tar.gz",
        "sha256": "C2E8A485110B97550F453226EC644EBAC6CB29D1CAEF2902C007EDAB4308D985",
        "bytes": 579853
      },
      "licenseFiles": [
        {
          "pathInSource": "COPYING",
          "sha256": "D2AB5758336489DA61C12CC5BB757DA5339C4AE9001F9BB0562B4370249AF814",
          "license": "BSD-3-Clause"
        }
      ],
      "patches": [],
      "buildProfile": {
        "system": "msbuild",
        "flags": [
          "generated-v143-project",
          "Configuration=Release",
          "Platform=x64",
          "RuntimeLibrary=MultiThreaded",
          "static"
        ],
        "inherit": "toolchain"
      },
      "outputs": [
        {
          "path": "out/deps/w1/lib/libogg_static.lib",
          "sha256": "7E902C4AEDE97913903D1FBE7345233CE45E11B59B049A66135D891863E2B49D",
          "bytes": 42366
        }
      ],
      "dependsOn": []
    },
    "libvorbis": {
      "kind": "archive",
      "wave": "W1",
      "upstream": "https://xiph.org/vorbis/",
      "version": "1.3.6",
      "archive": {
        "url": "https://downloads.xiph.org/releases/vorbis/libvorbis-1.3.6.tar.gz",
        "sha256": "6ED40E0241089A42C48604DC00E362BEEE00036AF2D8B3F46338031C9E0351CB",
        "bytes": 1634357
      },
      "licenseFiles": [
        {
          "pathInSource": "COPYING",
          "sha256": "29E9914E6173B7061B7D48C25E6159FC1438326738BC047CC7248ABC01B271F6",
          "license": "BSD-3-Clause"
        }
      ],
      "patches": [],
      "buildProfile": {
        "system": "msbuild",
        "flags": [
          "generated-v143-project",
          "Configuration=Release",
          "Platform=x64",
          "RuntimeLibrary=MultiThreaded",
          "static"
        ],
        "inherit": "toolchain"
      },
      "outputs": [
        {
          "path": "out/deps/w1/lib/libvorbis_static.lib",
          "sha256": "48584DD8C2571DEC84BC91EE42B3AC8930ACC9479BD33484193CA4EA850B1023",
          "bytes": 1060778
        },
        {
          "path": "out/deps/w1/lib/libvorbisfile_static.lib",
          "sha256": "20EA58116C846DE25B610E7C163575550395C83E2B635B34F0B8D2ECBF88B632",
          "bytes": 66102
        }
      ],
      "dependsOn": [
        "libogg"
      ]
    },
    "zlib": {
      "kind": "archive",
      "wave": "W2",
      "upstream": "https://zlib.net/",
      "version": "1.3.2",
      "archive": {
        "url": "https://www.zlib.net/zlib-1.3.2.tar.gz",
        "sha256": "bb329a0a2cd0274d05519d61c667c062e06990d72e125ee2dfa8de64f0119d16",
        "bytes": 1502830
      },
      "licenseFiles": [
        {
          "pathInSource": "LICENSE",
          "sha256": "e32ff4e00d9d94930537635291da39e7e612703334bf6fde8c7f1686fe8a45a2",
          "license": "Zlib"
        }
      ],
      "patches": [],
      "buildProfile": {
        "system": "cmake",
        "flags": [
          "-DZLIB_BUILD_SHARED=OFF",
          "-DZLIB_BUILD_STATIC=ON",
          "-DZLIB_BUILD_TESTING=OFF",
          "-DZLIB_INSTALL=OFF",
          "-DZLIB_PREFIX=OFF",
          "-DCMAKE_MSVC_RUNTIME_LIBRARY=MultiThreaded"
        ],
        "inherit": "toolchain"
      },
      "outputs": [
        {
          "path": "out/deps/w2/lib/zs.lib",
          "sha256": "5E37FB12086A20FF16AC9F4615C09AC06DB3D7982767FA4419D4200C36FFCFB7",
          "bytes": 198726
        }
      ],
      "dependsOn": []
    },
    "libzip": {
      "kind": "archive",
      "wave": "W2",
      "upstream": "https://libzip.org/",
      "version": "1.11.4",
      "archive": {
        "url": "https://libzip.org/download/libzip-1.11.4.tar.gz",
        "sha256": "82e9f2f2421f9d7c2466bbc3173cd09595a88ea37db0d559a9d0a2dc60dc722e",
        "bytes": 1301153
      },
      "licenseFiles": [
        {
          "pathInSource": "LICENSE",
          "sha256": "01c022eca6d566e2e8792fd0f091a28653b2a608319922bcd4de91c49d1438e1",
          "license": "BSD-3-Clause"